17,,,,,信息技术,1710,软件与服务,171010,互联网软件与服务,17101010,互联网软件与服务,开发与销售互联网软件和/或提供互联网服务的公司，这些服务包括在线数据库、交互服务、网络地址注册服务、数据库建设和互联网设计服务。包括那些提供移动视频服务的公司，不包括那些归类于“互联网零售”子行业中的公司。
　,,,,,　,　,　,　,　,17101011,云计算及其他云端服务,提供云计算及其他云端服务的公司。
　,,,,,　,　,　,171011,信息技术服务,17101110,信息科技咨询和系统集成服务,提供信息科技咨询和系统集成服务的公司（未归类于“数据处理与外包服务”或者“互联网软件与服务”、“物联网技术与服务”子行业）。
　,,,,,　,　,　,　,　,17101111,物联网技术与服务,提供物联网技术与服务的公司。
　,,,,,　,　,　,　,　,17101112,数据处理与外包服务,提供商业电子数据处理和/或经营流程外包服务的公司。包括那些提供事务部门办公自动化服务的公司。
　,,,,,　,　,　,171012,软件,17101210,应用软件,从事为企业和消费者开发与生产专业应用软件（包括企业与技术软件）的公司。不包括那些归类于“家庭娱乐软件”子行业中的公司，也不包括那些归类于“系统软件”子行业中生产系统和数据库管理软件的公司。
　,,,,,　,　,　,　,　,17101211,系统软件,从事开发与生产系统和数据库管理软件的公司。
,,,,,,,,,,17101212,家庭娱乐软件,开发主要在家中使用的家庭娱乐软件和教育软件的公司。包括那些制作网络或手机游戏的公司。
,,,,,,1711,技术硬件与设备,171110,电脑与外围设备,17111010,电脑硬件,制造个人电脑、服务器、大型机和工作站的公司。包括自动取款机(ATMs)制造商。不包括那些归类于“办公电子设备”子行业中制造复印机、传真机及相关产品的公司。
,,,,,,,,,,17111011,电脑存储与外围设备,电脑电子部件和外围设备制造商。包括数据存储部件、母板、声卡和显卡、监视器、键盘、打印机和其它外围设备。不包括归类于“半导体产品”子行业中的半导体产品。
,,,,,,,,171111,电子设备、仪器和元件,17111110,分析检测用电子设备与仪器及其他,包括分析监测用电子设备与仪器及其他电子设备与仪器。包括电子显示屏。不包括那些归类于“新能源设备与服务”，“智能电子识别设备”子行业下的公司。
,,,,,,,,,,17111111,智能电子识别设备,包括条码识别产品，激光器及其他使用物联网技术制造的安全系统设备。不包括那些归类于“新能源设备与服务”子行业下的公司。
,,,,,,,,,,17111112,其他电子元器件,其他电子元器件制造商。包括生产电池的公司。也包括那些制造光学镜片、光学镜头等的公司。不包括那些归类于“新能源设备与服务”子行业下的公司。
,,,,,,,,,,17111113,电子制造服务,主要为OEM（原始设备制造商）市场生产电子设备的公司。
,,,,,,,,,,17111114,技术产品经销商,技术硬件和设备经销商。包括经销通信设备、电脑及外围设备、半导体产品和电子设备及元器件的公司。
,,,,,,,,171112,办公电子设备,17111210,办公电子设备,包括复印机和传真机在内的办公电子产品的制造商。
,,,,,,1712,半导体产品与设备,171210,半导体产品与设备,17121010,半导体设备,半导体设备制造商。包括那些从事集成电路设计，封装与测试等集成电路相关业务的公司。
,,,,,,,,,,17121011,半导体产品,半导体产品及相关产品制造商。包括那些制造蓝牙通信模组的公司。
18,,,,,电信业务,1810,电信业务,181010,综合电信业务,18101010,非传统电信运营商,通过高带宽/光缆网络提供通信和海量数据传输业务的公司。
,,,,,,,,,,18101011,综合电信业务,主要指固定电信网络运营商以及提供无线和固话电信业务（未归类于别处）的公司。
,,,,,,,,181011,无线电信业务,18101110,无线电信业务,主要指提供蜂窝或无线电信业务（包括寻呼业务）的公司。
,,,,,,1811,通信设备及服务,181110,通信设备及服务,18111010,通信设备,制造包括调制解调器、解码器、交换机、光纤光缆、无线和卫星通信等设备的公司。包括移动电话和网络电话的制造商。也包括那些生产提示器的公司。
,,,,,,,,,,18111011,通信技术服务,提供通信设备技术服务的公司。包括技术方案设计、网络优化等相关技术服务。
,,,,,,1812,广播、有线和卫星电视,181210,广播、有线和卫星电视,18121010,广播,电视或电台广播系统的业主和运营商，包括制作公司。包括电台和电视广播、广播网络和广播站。
,,,,,,,,,,18121011,有线和卫星电视,提供有线或卫星电视服务。包括有线网络和节目发行。
19,,,,,公用事业,1910,公用事业,191010,电力公用事业,19101010,电力公用事业,发电和配电公司。
,,,,,,,,191011,燃气公用事业,19101110,燃气公用事业,包括主要任务为配送天然气和人工煤气的公司。不包括那些归类于“石油与天然气的勘探与生产”子行业中主要从事天然气勘探和生产的公司，也不包括那些归类于“石油与天然气的炼制、销售和运输”子行业中的各类处于市场中游的天然气公司。
,,,,,,,,191012,复合型公用事业,19101210,复合型公用事业,除主业为电力公用事业、燃气公用事业和/或水公用事业之外，还有其它多元化业务的公用事业公司。
,,,,,,,,191013,水公用事业,19101310,水公用事业,购买水后再把水配送给最终消费者的公司。包括大型水处理系统。
,,,,,,,,191014,独立电力生产商与能源贸易商,19101410,独立电力生产商与能源贸易商,独立电力生产商（IPPs）、燃气与电力专业销售贸易公司和/或综合性能源商。包括生产用于发电的太阳能和风能的公司。也包括通过其他能源生产电力以及/或其他动力的公司，例如沼气、生物质、清洁能源、地热、废料、水和波浪。不包括归类于“电力公用事业”子行业中的输电公司和配电公司。
,,,,,,,,191015,热力公用事业,19101510,热力公用事业,指利用煤炭、油、燃气等能源，通过锅炉等装置生产蒸汽和热水，或外购蒸汽、热水进行供应销售、供热设施的维护和管理的活动。
20,,,,,房地产,2010,房地产,201010,房地产管理和开发,20101010,多样化房地产活动,从事多种房地产活动的公司，包括房地产开发和销售、房地产管理或服务，但没有主营业务。
,,,,,,,,,,20101011,房地产经营公司,从事房地产出租和管理的房地产经营公司。
,,,,,,,,,,20101012,房地产开发,开发并销售房地产的公司。
,,,,,,,,,,20101013,房地产服务,提供诸如房地产代理、中介和评估服务的房地产服务公司。
